web-scraper-order|web-scraper-start-url|author|title|date|content|rating|next|next-href||
"1556764732-1513,https://www.amazon.com/Window-Unfortunate-Events-Snicket-2000-02-02/product-reviews/B017WQ76PQ/ref=cm_cr_arp_d_hist_5?ie=UTF8&reviewerType=all_reviews&filterByStar=five_star&pageNumber=1,Alex Engelbertson,Fits in with the box set too well. I'm giving up on love for the time being.,11-Jul-17,""A close friend of mine Ient her box set of this series to her sister who then returned it with this book missing. I purchased a used copy, wrote a short note telling her to enjoy her reading and the other wonderful parts of life, and then I snuck it into her collection without her noticing. It's been there for over a month now, and she still hasn't noticed it. I'm beginning to think she never will, as I've dropped hints and brought up the """"missing"""" book multiple times, and I think she's recognized that the book is not missing, but not that it had been replaced."||||||||||
||||||||||
This is bothersome because she's one of the most beautiful and worthwhile people I know| and I was hoping that continuing a friendship through reciprocal acts of kindness would eventually lead her to fall in love with me. It didn't seem too far fetched| as we have kissed several times| and I've been told I'm at least a decent-looking guy. But she hasn't noticed this book| and she just met some dude on tinder who is probably taller than I am (or more masculine etc.) My apologies| jealousy is as inevitable as it is unbecoming. This has coincided with the apparent waning of the frequency and quality of our communication (which used to be great)| to the point where she recently did not even wish me a happy birthday. I guess it's my fault for having the expectation she'd remember in lue of me not having a Facebook. But| I'm afraid it's time to own up to these realities and accept that this book is just as unnoticible as I am.|||
||||||||||
Anyway I'm 23 now| and old enough to get over a woman| even the most admirable of them.||||||||
"This book was exactly as described and in the expected condition. If I purchase any more novels in an effort to woo potential beauties, I intend to be more forthright. If you are purchasing for a similar purpose, may your romantic endeavours amount to more than a series of unfortunate events."",5.0 out of 5 stars,Next page?,https://www.amazon.com/Window-Unfortunate-Events-Snicket-2000-02-02/product-reviews/B017WQ76PQ/ref=cm_cr_arp_d_paging_btm_2?ie=UTF8&filterByStar=five_star&pageNumber=2&reviewerType=all_reviews"||||||||||
"1556764775-1700,https://www.amazon.com/Window-Unfortunate-Events-Snicket-2000-02-02/product-reviews/B017WQ76PQ/ref=cm_cr_arp_d_hist_5?ie=UTF8&reviewerType=all_reviews&filterByStar=five_star&pageNumber=1,Brenda,A series of unfortunate events number 2  the wide window,16-Aug-14,""I give  this book 5 stars because even though this  is a sad book I  11 year old fin  I  interesting for how every thing is because it took me  only 2 days to read this book  that is how interesting  and amazing it is"||||||||||
"  -sarah"",5.0 out of 5 stars,Next page?,https://www.amazon.com/Window-Unfortunate-Events-Snicket-2000-02-02/product-reviews/B017WQ76PQ/ref=cm_cr_arp_d_paging_btm_21?ie=UTF8&filterByStar=five_star&pageNumber=21&reviewerType=all_reviews"||||||||||
"1556764766-1657,https://www.amazon.com/Window-Unfortunate-Events-Snicket-2000-02-02/product-reviews/B017WQ76PQ/ref=cm_cr_arp_d_hist_5?ie=UTF8&reviewerType=all_reviews&filterByStar=five_star&pageNumber=1,Sandy,""Laugh-out-loud, cry-out loud, original, and exciting..."",15-Jan-02,""These books are very original-but also very good. At first when I started to read book 1-I didn't know what to expect. what kind of book is this-that the author advises you to NOT read his own book? But-it was so original and colorfully strange-that I LOVED it! I couldn't wait to get my hands on the next one-and I did so the next day! On went my rampage-finishing books as quickly as I bought them. This one-The Wide Window-is one of my favourites. Witty too-and though sad and frustrating at times-and frustration can be a good thing people-they are pleasantly twisted-not so normal and every-day ish. I'm very happy to give them all 5 stars."||||||||||
"[...]."",5.0 out of 5 stars,Next page?,https://www.amazon.com/Window-Unfortunate-Events-Snicket-2000-02-02/product-reviews/B017WQ76PQ/ref=cm_cr_arp_d_paging_btm_17?ie=UTF8&filterByStar=five_star&pageNumber=17&reviewerType=all_reviews"||||||||||
1556764730-1500|https://www.amazon.com/Window-Unfortunate-Events-Snicket-2000-02-02/product-reviews/B017WQ76PQ/ref=cm_cr_arp_d_hist_5?ie=UTF8&reviewerType=all_reviews&filterByStar=five_star&pageNumber=1|April|I am happy to buy any book he will read|23-Apr-18|Since the Netflix version has been out my young teenager has been interested in reading the series. I am happy to buy any book he will read. This arrived as promised.|5.0 out of 5 stars||||
1556764739-1537|https://www.amazon.com/Window-Unfortunate-Events-Snicket-2000-02-02/product-reviews/B017WQ76PQ/ref=cm_cr_arp_d_hist_5?ie=UTF8&reviewerType=all_reviews&filterByStar=five_star&pageNumber=1|Amazon Customer|AWESOME|9-Apr-15|This book was an awesome book. It is a great series. I loved it.  I recommend it to any one who liked the other books.|5.0 out of 5 stars|Next page?|https://www.amazon.com/Window-Unfortunate-Events-Snicket-2000-02-02/product-reviews/B017WQ76PQ/ref=cm_cr_arp_d_paging_btm_5?ie=UTF8&filterByStar=five_star&pageNumber=5&reviewerType=all_reviews||
1556764735-1525|https://www.amazon.com/Window-Unfortunate-Events-Snicket-2000-02-02/product-reviews/B017WQ76PQ/ref=cm_cr_arp_d_hist_5?ie=UTF8&reviewerType=all_reviews&filterByStar=five_star&pageNumber=1|Amazon Customer|Acurate|1-Feb-19|Acurate|5.0 out of 5 stars|Next page?|https://www.amazon.com/Window-Unfortunate-Events-Snicket-2000-02-02/product-reviews/B017WQ76PQ/ref=cm_cr_arp_d_paging_btm_3?ie=UTF8&filterByStar=five_star&pageNumber=3&reviewerType=all_reviews||
"1556764757-1623,https://www.amazon.com/Window-Unfortunate-Events-Snicket-2000-02-02/product-reviews/B017WQ76PQ/ref=cm_cr_arp_d_hist_5?ie=UTF8&reviewerType=all_reviews&filterByStar=five_star&pageNumber=1,Michael S. Kraus,The Orphans Must Outsmart the Evil Count Olaf Once Again,20-Feb-17,""Mr. Poe is responsible for maintaining the Baudelaire fortune.  He is also tasked with finding a suitable guardian for the orphans.  So far, in the series, he has not done very well at this."||||||||||
||||||||||
This time Mr. Poe has selected Aunt Josephine to be the orphans' guardian.  She might not be the best choice.  She is phobic about almost everything in her environment.  But| she is very good at grammar.  Both of these facts are important to this story.|||||||||
||||||||||
The orphans are doomed to have an unhappy visit with Aunt Josephine.||||||||||
||||||||||
The evil Count Olaf appears.  This time in the guise of Captain Sham.||||||||||
||||||||||
And| the orphans must prove to Mr. Poe that Captain Sham is Count Olaf.|||||||||
||||||||||
"For me, this was an enjoyable yet unhappy episode."",5.0 out of 5 stars,Next page?,https://www.amazon.com/Window-Unfortunate-Events-Snicket-2000-02-02/product-reviews/B017WQ76PQ/ref=cm_cr_arp_d_paging_btm_13?ie=UTF8&filterByStar=five_star&pageNumber=13&reviewerType=all_reviews"||||||||||
1556764746-1568|https://www.amazon.com/Window-Unfortunate-Events-Snicket-2000-02-02/product-reviews/B017WQ76PQ/ref=cm_cr_arp_d_hist_5?ie=UTF8&reviewerType=all_reviews&filterByStar=five_star&pageNumber=1|Kalil|Ahh|11-Jan-15|I love it. I almost bust out in tears at the end to hear what happened to the children. I read book one and two now reading book three makes me feel great. Now its time for me to read book 4.|5.0 out of 5 stars|Next page?|https://www.amazon.com/Window-Unfortunate-Events-Snicket-2000-02-02/product-reviews/B017WQ76PQ/ref=cm_cr_arp_d_paging_btm_8?ie=UTF8&filterByStar=five_star&pageNumber=8&reviewerType=all_reviews||
"1556764757-1622,https://www.amazon.com/Window-Unfortunate-Events-Snicket-2000-02-02/product-reviews/B017WQ76PQ/ref=cm_cr_arp_d_hist_5?ie=UTF8&reviewerType=all_reviews&filterByStar=five_star&pageNumber=1,ProudPolynesianGurl,An enjoyably quirky tale,21-Jun-17,""This is an amusing and interesting book that kept me curious till the very end.  Lemony Snickets tale of quirky misfortunes and schemes are entertainingly suspenseful and funny.  This story has descriptive language that easily allows the imagination to visualize it, exciting adventures and some important life lessons.  In the end, its about not giving up, no matter how grim the circumstances."||||||||||
||||||||||
The Wide Window is the third book in the Series of Unfortunate Events by Lemony Snicket.  In this book| the Baudelaire children| Violet| Klaus and Sunny| are moving in with their new guardian| Aunt Josephine| whose house is on the edge of a cliff above Lake Lachrymose. Aunt Josephine is a person crippled by her numerous fears from doorknobs to realtors.  Her only remaining love is grammar and she continually corrects the children. The children begin to settle in and feel safe in their new home.  However| these are the unlucky Baudelarie orphans and soon their misfortunes begin when their greatest enemy| Count Olaf| shows up disguised as a sailor. Soon| Aunt Josephine disappears and is feared dead.  It is now up to the children to try to stop Count Olaf's plan before they are delivered into his clutches once more.
||||||||||
The descriptive language throughout this story| easily allows the imagination to visualize it.  When the children first arrive at the house of Aunt Josephine| they get a perfect view of the town of Lake Lachrymose.  On page 10| the taxiarrived at the scraggly top of a tall| tall hill and the children could see the town far| far below them| the cobblestone road curling around the buildings like a tiny gray snake| and the small square of Damocles Dock with specks of people bustling around itand the inky blob of Lake Lachrymose| huge and dark as if a monster were standing over the three orphans| casting a giant shadow below them.  The language used allows the reader to play the scenes in their head and picture it playing out.|
||||||||||
The adventures of the children are exciting and nail biting.  As they search for clues in the note that Aunt Josephine left for them| the storm is raging on and the Aunt Josephines house is no longer safe.  On page 124| Aunt Josephines bedroom looked out onto the hill and the orphans could see one of the spidery metal stilts that kept Aunt Josephines house from falling into the lake.  But they could also see that this stilt had been badly damaged by the storma large black burn mark by lightning and the wind had bent the stilt into an uneasy curve.  As the children scramble to escape from the house| on page 125| the house gave another lurch and the children toppled to the floor again. Aunt Josephines house was starting to slip off the hill.  It is these adventures that captivate the reader to keep turning the pages till the very end.||||||
||||||||||
Finally| this story reminds readers of important lessons of determination and the value of family.  Beginning on page 132| the children are determined to find a sail boat so they can sail to Curdled Cave| in the middle of a hurricane| to find Aunt Josephine.  The ferry is closed due to the storm| but the children find another option; stealing a sail boat from Count Olaf and his wicked comrades.  The lesson is persistence in the face of difficulty| in order to accomplish the goal.  The fact that the Baudelaire children lost their parents| reminds us that to value the family we have and embrace each other no matter what.|||
||||||||||
"Through this all, the Baudelaire children did not give up when circumstances were against them.  We learn to persevere in the struggle and not let fear paralyze us.  I give this book a 5 out of 5, a must read!"",5.0 out of 5 stars,Next page?,https://www.amazon.com/Window-Unfortunate-Events-Snicket-2000-02-02/product-reviews/B017WQ76PQ/ref=cm_cr_arp_d_paging_btm_13?ie=UTF8&filterByStar=five_star&pageNumber=13&reviewerType=all_reviews"||||||||||
1556764744-1565|https://www.amazon.com/Window-Unfortunate-Events-Snicket-2000-02-02/product-reviews/B017WQ76PQ/ref=cm_cr_arp_d_hist_5?ie=UTF8&reviewerType=all_reviews&filterByStar=five_star&pageNumber=1|bitiyah asalifew|Amazing book|18-Jan-14|I love this book my friends told me I should read the series and I checked them out from my school library I finished them in one night after that I bought the next books on my kindle I think this is one of the best so far you should really read it.|5.0 out of 5 stars|Next page?|https://www.amazon.com/Window-Unfortunate-Events-Snicket-2000-02-02/product-reviews/B017WQ76PQ/ref=cm_cr_arp_d_paging_btm_7?ie=UTF8&filterByStar=five_star&pageNumber=7&reviewerType=all_reviews||
1556764753-1602|https://www.amazon.com/Window-Unfortunate-Events-Snicket-2000-02-02/product-reviews/B017WQ76PQ/ref=cm_cr_arp_d_hist_5?ie=UTF8&reviewerType=all_reviews&filterByStar=five_star&pageNumber=1|Mya Traylor|Outstanding|28-Feb-13|Great this book was  even better than the second book in which was  amazing as well lemony snicket is a genius|5.0 out of 5 stars|Next page?|https://www.amazon.com/Window-Unfortunate-Events-Snicket-2000-02-02/product-reviews/B017WQ76PQ/ref=cm_cr_arp_d_paging_btm_11?ie=UTF8&filterByStar=five_star&pageNumber=11&reviewerType=all_reviews||
1556764750-1590|https://www.amazon.com/Window-Unfortunate-Events-Snicket-2000-02-02/product-reviews/B017WQ76PQ/ref=cm_cr_arp_d_hist_5?ie=UTF8&reviewerType=all_reviews&filterByStar=five_star&pageNumber=1|Sunshine|Great!|6-Mar-15|This book was as great as the first. It was equally suspending and interesting as the last two. Worth the read!|5.0 out of 5 stars|Next page?|https://www.amazon.com/Window-Unfortunate-Events-Snicket-2000-02-02/product-reviews/B017WQ76PQ/ref=cm_cr_arp_d_paging_btm_10?ie=UTF8&filterByStar=five_star&pageNumber=10&reviewerType=all_reviews||
"1556764759-1635,https://www.amazon.com/Window-Unfortunate-Events-Snicket-2000-02-02/product-reviews/B017WQ76PQ/ref=cm_cr_arp_d_hist_5?ie=UTF8&reviewerType=all_reviews&filterByStar=five_star&pageNumber=1,""R, your friendly neighborhood reviewer"",Another good one!,16-Sep-04,""This is the book that turned me on to the SoUE series.  Since my local library didn't have the first two and I was desperate for a good series I read this one first.  And surprise! I loved it and feel in love with those persevering siblings.  Violet, with her thinking ribbon and Klaus and Sunny with their creative minds put together this unstopable force.  Bring it on Olaf!!"||||||||||
||||||||||
"  The Baudelaire orphans are once again in a new home with a relative even as strange as the last two( I said strange, not evil).  Aunt Josephine.  The name gives me shivers.  But not because of the way she treated our poor antagonists, but because of the warmthless time they spent with her on her house near the lake.  The orphans gaurdian also fears many things. For example, anything electrical or the lake, which is home to the Lachrymose leeches that killed her husband.  Since Josephine is scared of anything she only makes a boring pea soup for food.  As you may have guessed, Count Olaf has to come into the story sometime.  He is Captain Sham, the average one-eyed, rough talking sailor that our Josephine may have made a love connection with.  Come on, she was head over heels in love, right?"",5.0 out of 5 stars,Next page?,https://www.amazon.com/Window-Unfortunate-Events-Snicket-2000-02-02/product-reviews/B017WQ76PQ/ref=cm_cr_arp_d_paging_btm_14?ie=UTF8&filterByStar=five_star&pageNumber=14&reviewerType=all_reviews"||||||||||
"1556764770-1680,https://www.amazon.com/Window-Unfortunate-Events-Snicket-2000-02-02/product-reviews/B017WQ76PQ/ref=cm_cr_arp_d_hist_5?ie=UTF8&reviewerType=all_reviews&filterByStar=five_star&pageNumber=1,Stephanie,Yet another Great Story from Mr. Snicket.,19-Nov-04,""In this book, as with the second book, we don't really get any new information about the Baudelaire orphans or Count Olaf. There is just a new situation and one new character, Aunt Josephine, who has a fear of everything! Even thought there is nothing really new about this story, it's still a fun and entertaining read, and I am still going to continue on with the series."",5.0 out of 5 stars,Next page?,https://www.amazon.com/Window-Unfortunate-Events-Snicket-2000-02-02/product-reviews/B017WQ76PQ/ref=cm_cr_arp_d_paging_btm_19?ie=UTF8&filterByStar=five_star&pageNumber=19&reviewerType=all_reviews"||||||||||
1556764741-1554|https://www.amazon.com/Window-Unfortunate-Events-Snicket-2000-02-02/product-reviews/B017WQ76PQ/ref=cm_cr_arp_d_hist_5?ie=UTF8&reviewerType=all_reviews&filterByStar=five_star&pageNumber=1|energy101|Five Stars|6-Apr-15|Great reading for all ages.|5.0 out of 5 stars|Next page?|https://www.amazon.com/Window-Unfortunate-Events-Snicket-2000-02-02/product-reviews/B017WQ76PQ/ref=cm_cr_arp_d_paging_btm_6?ie=UTF8&filterByStar=five_star&pageNumber=6&reviewerType=all_reviews||
"1556764730-1497,https://www.amazon.com/Window-Unfortunate-Events-Snicket-2000-02-02/product-reviews/B017WQ76PQ/ref=cm_cr_arp_d_hist_5?ie=UTF8&reviewerType=all_reviews&filterByStar=five_star&pageNumber=1,Christina L. Schauffel,English 341 Review,29-Apr-14,""The Wide Window by Lemony Snicket was a wonderful novel. The vocabulary that the author uses can be uncommon, which allows for deeper thinking by students. Many students are familiar with the way in which an author writes a story. This author is able to change things up and require the reader to think more critically. Throughout the book the author uses exemplary imagery in order to portray his views. Snicket focuses on creating an image for the reader. This is useful for students that are mastering the metacognitive skill of image making. The reader is also given the opportunity to use the questioner meta cognitive skill throughout the novel. Snicket provides several thought provoking questions in his writing which helps students begin this process. As a future teacher this series is a useful resource to use. The many features that promote metacognitive learning techniques are what make this novel great."",5.0 out of 5 stars,,"||||||||||
1556764735-1521|https://www.amazon.com/Window-Unfortunate-Events-Snicket-2000-02-02/product-reviews/B017WQ76PQ/ref=cm_cr_arp_d_hist_5?ie=UTF8&reviewerType=all_reviews&filterByStar=five_star&pageNumber=1|Nisreen Rabie|It talks about the Baudelaire children in their unfortunate lives|4-Jul-18|Because this book is very interesting and spectacular.It has many different kinds of details and each one was amazing in its own way.|5.0 out of 5 stars|Next page?|https://www.amazon.com/Window-Unfortunate-Events-Snicket-2000-02-02/product-reviews/B017WQ76PQ/ref=cm_cr_arp_d_paging_btm_3?ie=UTF8&filterByStar=five_star&pageNumber=3&reviewerType=all_reviews||
"1556764770-1678,https://www.amazon.com/Window-Unfortunate-Events-Snicket-2000-02-02/product-reviews/B017WQ76PQ/ref=cm_cr_arp_d_hist_5?ie=UTF8&reviewerType=all_reviews&filterByStar=five_star&pageNumber=1,L. Ellis,I love Lemony Snicket,1-Jul-01,""This book is fabulous! The woeful lives of the Baudelaire orphans worsens when Mr.Poe, the man in charge of finding their guardians, puts them in the household of their Aunt Joshephine, who really isn't their aunt, but she is a distant relative. Their Aunt Joshephine is so paranoid, she will not touch the doorknob, turn on the stove, or step on the welcome mat. She is also fanatical about grammer. She never makes any gramatical mistake. Evil Count Olaf, who wants their enornmous fortune, is disgused as a sailboat seller . When Aunt Joshephine """"disapears"""", they are put almost put into the care of Count Olaf. Egad, what am I saying! I am revealing the plot. Just buy this book. It is a bit pricey, but it is well worth it!!!  It is witty and humorous. I also own  the 1st, 2nd, 4th, 5th, 6th, and 7th. I eagerly await the 8th book."",5.0 out of 5 stars,Next page?,https://www.amazon.com/Window-Unfortunate-Events-Snicket-2000-02-02/product-reviews/B017WQ76PQ/ref=cm_cr_arp_d_paging_btm_19?ie=UTF8&filterByStar=five_star&pageNumber=19&reviewerType=all_reviews"||||||||||
1556764753-1603|https://www.amazon.com/Window-Unfortunate-Events-Snicket-2000-02-02/product-reviews/B017WQ76PQ/ref=cm_cr_arp_d_hist_5?ie=UTF8&reviewerType=all_reviews&filterByStar=five_star&pageNumber=1|Samia Tubby|The best book of the series|1-Aug-13|Awesome book I will read every one of these books the cool part is that Klaus cracks a code and it shows that aunt Josephine is in a cave|5.0 out of 5 stars|Next page?|https://www.amazon.com/Window-Unfortunate-Events-Snicket-2000-02-02/product-reviews/B017WQ76PQ/ref=cm_cr_arp_d_paging_btm_11?ie=UTF8&filterByStar=five_star&pageNumber=11&reviewerType=all_reviews||
"1556764762-1642,https://www.amazon.com/Window-Unfortunate-Events-Snicket-2000-02-02/product-reviews/B017WQ76PQ/ref=cm_cr_arp_d_hist_5?ie=UTF8&reviewerType=all_reviews&filterByStar=five_star&pageNumber=1,Amazon Customer,""So Far, So Unfortunate"",13-Jan-05,""The third book in Lemony Snicket's A Series of Unfortunate Events, THE WIDE WINDOW, is definitely much darker than its two predecessors.  This time the three orphans are taken by the well-meaning but absent-minded Mr. Poe to live with their eccentric Aunt Josephine, who happens to be afraid of everything from hot soup to bad grammar, from radiators to realtors.  In fact, she seems to be afraid of everything except her house which hangs dangerously over a cliff and the other newcomer to the island, Captain Sham who bears a striking resemblance to...well, I don't want to give too much away."||||||||||
||||||||||
Lemony Snicket (aka Daniel Handler) excels in this third book in terms of his use of clever humor and dry wit to twist and turn the plot.  The reader is also exposed to the darker sides of Count Olaf.||||||||||
||||||||||
"Overall, this is a great addition to the series, and with ten books to go, it does well in keeping the reader interested in the series."",5.0 out of 5 stars,Next page?,https://www.amazon.com/Window-Unfortunate-Events-Snicket-2000-02-02/product-reviews/B017WQ76PQ/ref=cm_cr_arp_d_paging_btm_15?ie=UTF8&filterByStar=five_star&pageNumber=15&reviewerType=all_reviews"||||||||||
1556764770-1684|https://www.amazon.com/Window-Unfortunate-Events-Snicket-2000-02-02/product-reviews/B017WQ76PQ/ref=cm_cr_arp_d_hist_5?ie=UTF8&reviewerType=all_reviews&filterByStar=five_star&pageNumber=1|Crazy cat lady|great read|22-Jan-17|I really liked this book so good. Loved the movie book was just as good.|5.0 out of 5 stars|Next page?|https://www.amazon.com/Window-Unfortunate-Events-Snicket-2000-02-02/product-reviews/B017WQ76PQ/ref=cm_cr_arp_d_paging_btm_19?ie=UTF8&filterByStar=five_star&pageNumber=19&reviewerType=all_reviews||
"1556764750-1587,https://www.amazon.com/Window-Unfortunate-Events-Snicket-2000-02-02/product-reviews/B017WQ76PQ/ref=cm_cr_arp_d_hist_5?ie=UTF8&reviewerType=all_reviews&filterByStar=five_star&pageNumber=1,Paula,Very interesting book,13-Sep-13,""IT MAY BE SAD, BUT IT IS A GREAT BOOK IF U CAN HANDLE A WHOLE LOT OF UNFORTUNATE EVENTS 5start great book but at the end it shows a pic dat lemony wrote(lettter) must have been long ago i wan  to read more"",5.0 out of 5 stars,Next page?,https://www.amazon.com/Window-Unfortunate-Events-Snicket-2000-02-02/product-reviews/B017WQ76PQ/ref=cm_cr_arp_d_paging_btm_10?ie=UTF8&filterByStar=five_star&pageNumber=10&reviewerType=all_reviews"||||||||||
1556764730-1501|https://www.amazon.com/Window-Unfortunate-Events-Snicket-2000-02-02/product-reviews/B017WQ76PQ/ref=cm_cr_arp_d_hist_5?ie=UTF8&reviewerType=all_reviews&filterByStar=five_star&pageNumber=1|Cody Bawden|Great and depressing|7-Mar-19|These books are all right. Ironic at best but very enjoyable. Me and my kids read them and then go watch the episodes on Netflix.|5.0 out of 5 stars||||
1556764755-1613|https://www.amazon.com/Window-Unfortunate-Events-Snicket-2000-02-02/product-reviews/B017WQ76PQ/ref=cm_cr_arp_d_hist_5?ie=UTF8&reviewerType=all_reviews&filterByStar=five_star&pageNumber=1|April Ritter|Awesome|15-Jan-13|The best book I read so far! I love Lemony Snicket! And the Series of Unfortunate Events! The best books|5.0 out of 5 stars|Next page?|https://www.amazon.com/Window-Unfortunate-Events-Snicket-2000-02-02/product-reviews/B017WQ76PQ/ref=cm_cr_arp_d_paging_btm_12?ie=UTF8&filterByStar=five_star&pageNumber=12&reviewerType=all_reviews||
"1556764773-1687,https://www.amazon.com/Window-Unfortunate-Events-Snicket-2000-02-02/product-reviews/B017WQ76PQ/ref=cm_cr_arp_d_hist_5?ie=UTF8&reviewerType=all_reviews&filterByStar=five_star&pageNumber=1,Chuck,Great book,9-May-18,""I loved it when all the children work tough there and solve all there problems,or most of them. I also like how they love each other even though its hard to do."",5.0 out of 5 stars,Next page?,https://www.amazon.com/Window-Unfortunate-Events-Snicket-2000-02-02/product-reviews/B017WQ76PQ/ref=cm_cr_arp_d_paging_btm_20?ie=UTF8&filterByStar=five_star&pageNumber=20&reviewerType=all_reviews"||||||||||
"1556764757-1625,https://www.amazon.com/Window-Unfortunate-Events-Snicket-2000-02-02/product-reviews/B017WQ76PQ/ref=cm_cr_arp_d_hist_5?ie=UTF8&reviewerType=all_reviews&filterByStar=five_star&pageNumber=1,J. Butler,Great Read,14-Jul-15,""Ah, time for a new relative to stay with after the last book. Aunt Josephine is the new care taker in the volume. She lives on a cliff about a lake, and she is terrified of just about everything after her husband died. Mr. Poe is more useless than ever in this book. There is a bit more mystery involved with the disappearance of Aunt Josephine and a suicide note she leaves."||||||||||
||||||||||
