web-scraper-order|web-scraper-start-url|author|title|date|content|rating|next|next-href||
1556764732-1510|https://www.amazon.com/Window-Unfortunate-Events-Snicket-2000-02-02/product-reviews/B017WQ76PQ/ref=cm_cr_arp_d_hist_5?ie=UTF8&reviewerType=all_reviews&filterByStar=five_star&pageNumber=1|Amazon Customer|Good book for 10 Year Old Boy|2-Mar-17|My grandson had this series of books that I had gotten him at Goodwill. He was missing 2 of them and I was able to find them on amazon. He said all of them were good.|5.0 out of 5 stars|Next page?|https://www.amazon.com/Window-Unfortunate-Events-Snicket-2000-02-02/product-reviews/B017WQ76PQ/ref=cm_cr_arp_d_paging_btm_2?ie=UTF8&filterByStar=five_star&pageNumber=2&reviewerType=all_reviews||
1556764768-1673|https://www.amazon.com/Window-Unfortunate-Events-Snicket-2000-02-02/product-reviews/B017WQ76PQ/ref=cm_cr_arp_d_hist_5?ie=UTF8&reviewerType=all_reviews&filterByStar=five_star&pageNumber=1|Jennifer Manista|Five Stars|6-Jan-18|A really good book for a good series. A good read for 9+.|5.0 out of 5 stars|Next page?|https://www.amazon.com/Window-Unfortunate-Events-Snicket-2000-02-02/product-reviews/B017WQ76PQ/ref=cm_cr_arp_d_paging_btm_18?ie=UTF8&filterByStar=five_star&pageNumber=18&reviewerType=all_reviews||
"1556764730-1504,https://www.amazon.com/Window-Unfortunate-Events-Snicket-2000-02-02/product-reviews/B017WQ76PQ/ref=cm_cr_arp_d_hist_5?ie=UTF8&reviewerType=all_reviews&filterByStar=five_star&pageNumber=1,Kathy C. Anderson,""Great writing, even if a bit dark"",8-Oct-17,""The Netflix series inspired my kids to read the novels.  Great writing, even if a bit dark.  The resourcefulness of the children is remarkable!"",5.0 out of 5 stars,,"||||||||||
1556764737-1526|https://www.amazon.com/Window-Unfortunate-Events-Snicket-2000-02-02/product-reviews/B017WQ76PQ/ref=cm_cr_arp_d_hist_5?ie=UTF8&reviewerType=all_reviews&filterByStar=five_star&pageNumber=1|Bookworm|Great gift!|15-Oct-15|Gift for my granddaughter who enjoyed the series.|5.0 out of 5 stars|Next page?|https://www.amazon.com/Window-Unfortunate-Events-Snicket-2000-02-02/product-reviews/B017WQ76PQ/ref=cm_cr_arp_d_paging_btm_4?ie=UTF8&filterByStar=five_star&pageNumber=4&reviewerType=all_reviews||
1556764750-1589|https://www.amazon.com/Window-Unfortunate-Events-Snicket-2000-02-02/product-reviews/B017WQ76PQ/ref=cm_cr_arp_d_hist_5?ie=UTF8&reviewerType=all_reviews&filterByStar=five_star&pageNumber=1|love it!!!|LOVE IT!!!|10-Mar-13|I love this book because it was very exciting and nothing happened the way you expected it to.  I recommend it to everyone!|5.0 out of 5 stars|Next page?|https://www.amazon.com/Window-Unfortunate-Events-Snicket-2000-02-02/product-reviews/B017WQ76PQ/ref=cm_cr_arp_d_paging_btm_10?ie=UTF8&filterByStar=five_star&pageNumber=10&reviewerType=all_reviews||
1556764739-1538|https://www.amazon.com/Window-Unfortunate-Events-Snicket-2000-02-02/product-reviews/B017WQ76PQ/ref=cm_cr_arp_d_hist_5?ie=UTF8&reviewerType=all_reviews&filterByStar=five_star&pageNumber=1|Amazon Customer|Good book|23-May-12|I am a school librarian and I needed a quick extra cppy of this book for a student.  Quick delivery ( I am an Amazon Prime customer) !!  Just exactly what I thought I was getting quality wise.|5.0 out of 5 stars|Next page?|https://www.amazon.com/Window-Unfortunate-Events-Snicket-2000-02-02/product-reviews/B017WQ76PQ/ref=cm_cr_arp_d_paging_btm_5?ie=UTF8&filterByStar=five_star&pageNumber=5&reviewerType=all_reviews||
"1556764748-1583,https://www.amazon.com/Window-Unfortunate-Events-Snicket-2000-02-02/product-reviews/B017WQ76PQ/ref=cm_cr_arp_d_hist_5?ie=UTF8&reviewerType=all_reviews&filterByStar=five_star&pageNumber=1,AWESOMENESS!!!!,Awesome but sad,25-Mar-14,""I chose this book because I think that book 1and 2 were like, the best books I've ever read. So I think that you should really get this book it's awesome."||||||||||
||||||||||
"  GET THIS BOOK!!!"",5.0 out of 5 stars,Next page?,https://www.amazon.com/Window-Unfortunate-Events-Snicket-2000-02-02/product-reviews/B017WQ76PQ/ref=cm_cr_arp_d_paging_btm_9?ie=UTF8&filterByStar=five_star&pageNumber=9&reviewerType=all_reviews"||||||||||
1556764775-1697|https://www.amazon.com/Window-Unfortunate-Events-Snicket-2000-02-02/product-reviews/B017WQ76PQ/ref=cm_cr_arp_d_hist_5?ie=UTF8&reviewerType=all_reviews&filterByStar=five_star&pageNumber=1|Caitlin Kirby|A series of unfortunate events number three the wide window|25-Mar-13|Five stars. This story is perfect for the adventure type. It is also a great story for the people who have many fears you will learn to face them. This is not a series for the faint hearted.|5.0 out of 5 stars|Next page?|https://www.amazon.com/Window-Unfortunate-Events-Snicket-2000-02-02/product-reviews/B017WQ76PQ/ref=cm_cr_arp_d_paging_btm_21?ie=UTF8&filterByStar=five_star&pageNumber=21&reviewerType=all_reviews||
"1556764773-1690,https://www.amazon.com/Window-Unfortunate-Events-Snicket-2000-02-02/product-reviews/B017WQ76PQ/ref=cm_cr_arp_d_hist_5?ie=UTF8&reviewerType=all_reviews&filterByStar=five_star&pageNumber=1,Megan,""The Wide Window, #3"",14-Jul-05,""This was the first Lemony Snicket book I read, and what got me into the series. Aunt Josephine is hilarious! I loved her paranoid nature. Probably one of the most humorous in the series, The Austere Academy is also funny! """"Cakesniffers!"""" LOL. Anyways, the 3rd installment will not be a dissapointment to fans of Lemony. I especially enjoyed the thought of Hurricane Herman, as we in Florida where experiencing one at the time. I think Daniel..oops, Lemony did a good job. Pick it up today! A wonderful addition to any Series of Unfortunate Events collection! Also, I love Captain Sham! Ho ho!"",5.0 out of 5 stars,Next page?,https://www.amazon.com/Window-Unfortunate-Events-Snicket-2000-02-02/product-reviews/B017WQ76PQ/ref=cm_cr_arp_d_paging_btm_20?ie=UTF8&filterByStar=five_star&pageNumber=20&reviewerType=all_reviews"||||||||||
1556764739-1541|https://www.amazon.com/Window-Unfortunate-Events-Snicket-2000-02-02/product-reviews/B017WQ76PQ/ref=cm_cr_arp_d_hist_5?ie=UTF8&reviewerType=all_reviews&filterByStar=five_star&pageNumber=1|fak u broteem|Five Stars|20-Sep-16|Ok|5.0 out of 5 stars|Next page?|https://www.amazon.com/Window-Unfortunate-Events-Snicket-2000-02-02/product-reviews/B017WQ76PQ/ref=cm_cr_arp_d_paging_btm_5?ie=UTF8&filterByStar=five_star&pageNumber=5&reviewerType=all_reviews||
1556764735-1518|https://www.amazon.com/Window-Unfortunate-Events-Snicket-2000-02-02/product-reviews/B017WQ76PQ/ref=cm_cr_arp_d_hist_5?ie=UTF8&reviewerType=all_reviews&filterByStar=five_star&pageNumber=1|jessica|Great books!|24-Apr-16|Great books for kids of all ages! Bought the whole series for my 12 year old. He doesn't love reading but these books keep him entertained!|5.0 out of 5 stars|Next page?|https://www.amazon.com/Window-Unfortunate-Events-Snicket-2000-02-02/product-reviews/B017WQ76PQ/ref=cm_cr_arp_d_paging_btm_3?ie=UTF8&filterByStar=five_star&pageNumber=3&reviewerType=all_reviews||
1556764730-1499|https://www.amazon.com/Window-Unfortunate-Events-Snicket-2000-02-02/product-reviews/B017WQ76PQ/ref=cm_cr_arp_d_hist_5?ie=UTF8&reviewerType=all_reviews&filterByStar=five_star&pageNumber=1|UndergroundAJ|Good read decent priced|23-Mar-19|Good read...loved the TV show on Netflix n books make more of what happened in the show even more so reading these books|5.0 out of 5 stars||||
1556764748-1579|https://www.amazon.com/Window-Unfortunate-Events-Snicket-2000-02-02/product-reviews/B017WQ76PQ/ref=cm_cr_arp_d_hist_5?ie=UTF8&reviewerType=all_reviews&filterByStar=five_star&pageNumber=1|Elizabeth Santanna|THE WIDE WINDOW|13-Mar-14|THIS BOOK WAS ABOUT THREE ORPHANS WHO GO TO LIVE WITH THEIR AUNT JOSEPHINE WHO IS PRETTY MUCH AFRAID OF EVERYTHING.|5.0 out of 5 stars|Next page?|https://www.amazon.com/Window-Unfortunate-Events-Snicket-2000-02-02/product-reviews/B017WQ76PQ/ref=cm_cr_arp_d_paging_btm_9?ie=UTF8&filterByStar=five_star&pageNumber=9&reviewerType=all_reviews||
"1556764777-1710,https://www.amazon.com/Window-Unfortunate-Events-Snicket-2000-02-02/product-reviews/B017WQ76PQ/ref=cm_cr_arp_d_hist_5?ie=UTF8&reviewerType=all_reviews&filterByStar=five_star&pageNumber=1,Nancy E.,Is there a shred of hope for the three orphans?,6-Nov-00,""In this book things go down hill from the first few pages. The three clever orphans go to live with there Aunt only to find out that she dosen't understand children at all. She's afraid of virtually anything and is obessed with grammer. When Count Oalf shows up how will she react? I love this book, and in my opinion it's one of the best in the series. If you love funny, witty tales that don't nessicarily have the happiest ending in the world this book is for you. Lemony Snicket once again delivers a great book. I reccomend it to any fans of the series."",5.0 out of 5 stars,Next page?,https://www.amazon.com/Window-Unfortunate-Events-Snicket-2000-02-02/product-reviews/B017WQ76PQ/ref=cm_cr_arp_d_paging_btm_22?ie=UTF8&filterByStar=five_star&pageNumber=22&reviewerType=all_reviews"||||||||||
"1556764762-1645,https://www.amazon.com/Window-Unfortunate-Events-Snicket-2000-02-02/product-reviews/B017WQ76PQ/ref=cm_cr_arp_d_hist_5?ie=UTF8&reviewerType=all_reviews&filterByStar=five_star&pageNumber=1,felixthecat,Another consequence,1-May-11,""I believe one of the morals of this story is, be grateful for the parents you have. In a world were """"there is nothing to eat in the house"""" is too typically just code for """"there is nothing in the house I am in the mood for"""" this book could potentially offer a shift of perspective for young readers. The writer knows a lot about rhetorical analysis, so this book series might also be useful for kids to learn about the darker sides of communication, which will face them in different situations for the rest of their lives. The bright side of the story is that no matter how unreal the pain and suffering becomes in the lives of the Baudelaire children, they take care of one another and adamantly refuse to take things out on each other."||||||||||
||||||||||
This might not be the right story book for your kid| each one is unique and needs individual attention and care. This might be a good book to read along with your child| because many of life's more difficult issues will come into focus while reading it| it could be a chance to talk with your young reader about those issues.|||||||
||||||||||
"Let me know if this helps anyone. Morgan."",5.0 out of 5 stars,Next page?,https://www.amazon.com/Window-Unfortunate-Events-Snicket-2000-02-02/product-reviews/B017WQ76PQ/ref=cm_cr_arp_d_paging_btm_15?ie=UTF8&filterByStar=five_star&pageNumber=15&reviewerType=all_reviews"||||||||||
1556764748-1580|https://www.amazon.com/Window-Unfortunate-Events-Snicket-2000-02-02/product-reviews/B017WQ76PQ/ref=cm_cr_arp_d_hist_5?ie=UTF8&reviewerType=all_reviews&filterByStar=five_star&pageNumber=1|Jime|A sireies of unfortunate events#3 the wide window|18-Jan-15|I liked that there were many adventures and it was so interesting you couldn't stop reading I liked that lemony snicket  described things very good I would like to read the next book|5.0 out of 5 stars|Next page?|https://www.amazon.com/Window-Unfortunate-Events-Snicket-2000-02-02/product-reviews/B017WQ76PQ/ref=cm_cr_arp_d_paging_btm_9?ie=UTF8&filterByStar=five_star&pageNumber=9&reviewerType=all_reviews||
1556764732-1514|https://www.amazon.com/Window-Unfortunate-Events-Snicket-2000-02-02/product-reviews/B017WQ76PQ/ref=cm_cr_arp_d_hist_5?ie=UTF8&reviewerType=all_reviews&filterByStar=five_star&pageNumber=1|Srwilder|Five Stars|11-Jan-18|My class loves it!|5.0 out of 5 stars|Next page?|https://www.amazon.com/Window-Unfortunate-Events-Snicket-2000-02-02/product-reviews/B017WQ76PQ/ref=cm_cr_arp_d_paging_btm_2?ie=UTF8&filterByStar=five_star&pageNumber=2&reviewerType=all_reviews||
1556764741-1549|https://www.amazon.com/Window-Unfortunate-Events-Snicket-2000-02-02/product-reviews/B017WQ76PQ/ref=cm_cr_arp_d_hist_5?ie=UTF8&reviewerType=all_reviews&filterByStar=five_star&pageNumber=1|Terri|Five Stars|14-Jan-16|My daughter loved it..|5.0 out of 5 stars|Next page?|https://www.amazon.com/Window-Unfortunate-Events-Snicket-2000-02-02/product-reviews/B017WQ76PQ/ref=cm_cr_arp_d_paging_btm_6?ie=UTF8&filterByStar=five_star&pageNumber=6&reviewerType=all_reviews||
"1556764764-1650,https://www.amazon.com/Window-Unfortunate-Events-Snicket-2000-02-02/product-reviews/B017WQ76PQ/ref=cm_cr_arp_d_hist_5?ie=UTF8&reviewerType=all_reviews&filterByStar=five_star&pageNumber=1,Pam,ANOTHER GREAT LEMONY SNICKET BOOK!! #ASOUE,28-Feb-18,""I started reading these books after I watched the Netflix series. My brother told me about the show and we watched them together. The books aren't exacly as good as the show! They're even better!!!! I wish I got introduced to this particular series earlier. Great Job Mr. Snicket. Please keep writing these books! You would please all your readers very much. Thank you! I look forward to more books soon."||||||||||
||||||||||
Thank You||||||||||
"Aubrey"",5.0 out of 5 stars,Next page?,https://www.amazon.com/Window-Unfortunate-Events-Snicket-2000-02-02/product-reviews/B017WQ76PQ/ref=cm_cr_arp_d_paging_btm_16?ie=UTF8&filterByStar=five_star&pageNumber=16&reviewerType=all_reviews"||||||||||
"1556764741-1550,https://www.amazon.com/Window-Unfortunate-Events-Snicket-2000-02-02/product-reviews/B017WQ76PQ/ref=cm_cr_arp_d_hist_5?ie=UTF8&reviewerType=all_reviews&filterByStar=five_star&pageNumber=1,hollagirl89,Great condition!,8-Mar-17,""The book was in great condition, with no marks or tears. I am very happy with this product!!"",5.0 out of 5 stars,Next page?,https://www.amazon.com/Window-Unfortunate-Events-Snicket-2000-02-02/product-reviews/B017WQ76PQ/ref=cm_cr_arp_d_paging_btm_6?ie=UTF8&filterByStar=five_star&pageNumber=6&reviewerType=all_reviews"||||||||||
1556764753-1596|https://www.amazon.com/Window-Unfortunate-Events-Snicket-2000-02-02/product-reviews/B017WQ76PQ/ref=cm_cr_arp_d_hist_5?ie=UTF8&reviewerType=all_reviews&filterByStar=five_star&pageNumber=1|Erin|A series of unfortunate events #3:the wide window|26-Jan-13|I liked how it is so intense and I just don't want to stop the reading once I start . I would recommend this book to every 3-6th grader .oh by the way this is Erin's daughter.|5.0 out of 5 stars|Next page?|https://www.amazon.com/Window-Unfortunate-Events-Snicket-2000-02-02/product-reviews/B017WQ76PQ/ref=cm_cr_arp_d_paging_btm_11?ie=UTF8&filterByStar=five_star&pageNumber=11&reviewerType=all_reviews||
1556764757-1617|https://www.amazon.com/Window-Unfortunate-Events-Snicket-2000-02-02/product-reviews/B017WQ76PQ/ref=cm_cr_arp_d_hist_5?ie=UTF8&reviewerType=all_reviews&filterByStar=five_star&pageNumber=1|Sara Fishel|5 star|28-Dec-12|It's  a great book that I love and it's really hard for me to find a book that IS like.|5.0 out of 5 stars|Next page?|https://www.amazon.com/Window-Unfortunate-Events-Snicket-2000-02-02/product-reviews/B017WQ76PQ/ref=cm_cr_arp_d_paging_btm_13?ie=UTF8&filterByStar=five_star&pageNumber=13&reviewerType=all_reviews||
"1556764762-1639,https://www.amazon.com/Window-Unfortunate-Events-Snicket-2000-02-02/product-reviews/B017WQ76PQ/ref=cm_cr_arp_d_hist_5?ie=UTF8&reviewerType=all_reviews&filterByStar=five_star&pageNumber=1,hiphopgirl_1000,Tragedy follows...,25-Nov-01,""""""The Wide Window"""" is in my view the most sad and tragic of all the books in Lemony Snicket's """"A Series of Unfortunate Events"""" centered on the life of the orphans Violet, Klaus, and Sunny. In book the third the Baudelairs are taken by their lawyer Mr.Poe to live with Aunt Josephine at her house on the top of the mountain at Lake Lachrymose, home of the venomous Lachrymose Leeches. Aunt Josephine is scared of everything and expects diaster to always be around the corner. She thinks she will get burned by using the stove so the Baudelairs have to settle with the most awful cold cucumber soup they have ever tasted. Plus Aunt Josephine loves nothing more than grammar and constantly corrects the orphans mistakes. However Violet, Klaus, and Sunny are thankful that Count Olaf hasn't appeared in the quiet Lake Lachrymose yet. Their luck doesn't last long. It seems this time Count Olaf disguises himself as Captain Sham a sea captain!!! He totally fools Aunt Josephine but not the Baudelairs! Mysteriously Aunt Josephine seems to have commited suicide after a phone call to Captain Sham and has left the children under his care! Can the Baudelair orphans foil his evil plans once again?"||||||||||
"I found this book to be very sad even though it was still hilirous. Lemony Snicket truly works his magic in these books. I can't wait to read his autobiography!"",5.0 out of 5 stars,Next page?,https://www.amazon.com/Window-Unfortunate-Events-Snicket-2000-02-02/product-reviews/B017WQ76PQ/ref=cm_cr_arp_d_paging_btm_15?ie=UTF8&filterByStar=five_star&pageNumber=15&reviewerType=all_reviews"||||||||||
"1556764730-1498,https://www.amazon.com/Window-Unfortunate-Events-Snicket-2000-02-02/product-reviews/B017WQ76PQ/ref=cm_cr_arp_d_hist_5?ie=UTF8&reviewerType=all_reviews&filterByStar=five_star&pageNumber=1,FloB,Very Entertaining Series!,22-May-03,""I purchased books 1-5 on audio tape to listen to with my children while driving in the car. My how time flys when you are hearing about the perils of the Baudelaire children. I notice traffic doesn't bother me half as much while I am listening to these stories. Somethings in life could be much worse than sitting in bumper to bumper traffic."||||||||||
My children enjoy the stories so much that they don't just want to listen in the car anymore. Every night before they go to bed we listen to about an hour of the tape.||||||||||
Also| I think my children appreciate me more after they see what a hard life these children have.|||||||||
"I would recommend these stories for older children (older then 7). Younger or overly sensitive children might get scared or become upset by some of the things that happen."",5.0 out of 5 stars,,"||||||||||
"1556764775-1698,https://www.amazon.com/Window-Unfortunate-Events-Snicket-2000-02-02/product-reviews/B017WQ76PQ/ref=cm_cr_arp_d_hist_5?ie=UTF8&reviewerType=all_reviews&filterByStar=five_star&pageNumber=1,Mike and Ike,The Wide Window,3-Dec-01,""LOL...  This book was an excellent, though not the best of the series so far.  Lemony Snicket's series is just addictive."",5.0 out of 5 stars,Next page?,https://www.amazon.com/Window-Unfortunate-Events-Snicket-2000-02-02/product-reviews/B017WQ76PQ/ref=cm_cr_arp_d_paging_btm_21?ie=UTF8&filterByStar=five_star&pageNumber=21&reviewerType=all_reviews"||||||||||
"1556764746-1571,https://www.amazon.com/Window-Unfortunate-Events-Snicket-2000-02-02/product-reviews/B017WQ76PQ/ref=cm_cr_arp_d_hist_5?ie=UTF8&reviewerType=all_reviews&filterByStar=five_star&pageNumber=1,Dmitry Buk,i like this book because its really interesting and it makes ...,5-Nov-14,""i like this book because its really interesting and it makes you want to keep reading it  - i am 8 years old , i loved the book"",5.0 out of 5 stars,Next page?,https://www.amazon.com/Window-Unfortunate-Events-Snicket-2000-02-02/product-reviews/B017WQ76PQ/ref=cm_cr_arp_d_paging_btm_8?ie=UTF8&filterByStar=five_star&pageNumber=8&reviewerType=all_reviews"||||||||||
"1556764770-1685,https://www.amazon.com/Window-Unfortunate-Events-Snicket-2000-02-02/product-reviews/B017WQ76PQ/ref=cm_cr_arp_d_hist_5?ie=UTF8&reviewerType=all_reviews&filterByStar=five_star&pageNumber=1,Brittany,""A sad, but good book"",20-Nov-01,This book was especially good because it had a lot of suprises.  At the end when they are trapped in Lake Lacrhymose the suspense was killing me because you didn't expect Count Olaf to come and rescue the orphans.  I disliked Count Olaf a lot because he is so obsessed with money.  The orphans are really smart and Sunny surprised me with her abilities to do thing for a very small child.  I didn't like Mr.Poe either.  I like Aunt Josephine even though I thought she was a freak.  I felt really bad for her because her husband died.  I felt really bad for the orphans too because their parents died and all these bad things keep happening to them. Over all the book was really good and I can't wait to read another book about the Baudlaire orphans.,5.0 out of 5 stars,Next page?,https://www.amazon.com/Window-Unfortunate-Events-Snicket-2000-02-02/product-reviews/B017WQ76PQ/ref=cm_cr_arp_d_paging_btm_19?ie=UTF8&filterByStar=five_star&pageNumber=19&reviewerType=all_reviews"||||||||||
"1556764775-1696,https://www.amazon.com/Window-Unfortunate-Events-Snicket-2000-02-02/product-reviews/B017WQ76PQ/ref=cm_cr_arp_d_hist_5?ie=UTF8&reviewerType=all_reviews&filterByStar=five_star&pageNumber=1,J. Cohen,Best of the year,17-Oct-01,""I liked Series of Unfortunate Events because it is full of adventure. I loved The Wide Window.It is a 10 and up book.I think it's a sad but good book. My favorite character is Sunny, an infant. I like her because she is cute."",5.0 out of 5 stars,Next page?,https://www.amazon.com/Window-Unfortunate-Events-Snicket-2000-02-02/product-reviews/B017WQ76PQ/ref=cm_cr_arp_d_paging_btm_21?ie=UTF8&filterByStar=five_star&pageNumber=21&reviewerType=all_reviews"||||||||||
"1556764768-1671,https://www.amazon.com/Window-Unfortunate-Events-Snicket-2000-02-02/product-reviews/B017WQ76PQ/ref=cm_cr_arp_d_hist_5?ie=UTF8&reviewerType=all_reviews&filterByStar=five_star&pageNumber=1,Loretta McCarney,I love the whole series!!!,27-May-15,""I can't stop reading about these children. I finish one book and want to start reading the next one knowing that it will be filled with more unfortunate events. However, Violet, Klaus and Sunny are like energizer bunnies, they keep going and going and going. I know they will make it through the Miserable Mill and I can't help but hope for a little bit of happiness for the children, and maybe even a happy ending when all is written and done. Thank you Lemony Snicket!!!"",5.0 out of 5 stars,Next page?,https://www.amazon.com/Window-Unfortunate-Events-Snicket-2000-02-02/product-reviews/B017WQ76PQ/ref=cm_cr_arp_d_paging_btm_18?ie=UTF8&filterByStar=five_star&pageNumber=18&reviewerType=all_reviews"||||||||||
1556764737-1528|https://www.amazon.com/Window-Unfortunate-Events-Snicket-2000-02-02/product-reviews/B017WQ76PQ/ref=cm_cr_arp_d_hist_5?ie=UTF8&reviewerType=all_reviews&filterByStar=five_star&pageNumber=1|John P Nowell|Love this Series|22-Jan-14|I originally borrowed this series from a friend and fell in love and had to have my own copies! I have the entire series and read it yearly! I love the dark side but where good prevails!|5.0 out of 5 stars|Next page?|https://www.amazon.com/Window-Unfortunate-Events-Snicket-2000-02-02/product-reviews/B017WQ76PQ/ref=cm_cr_arp_d_paging_btm_4?ie=UTF8&filterByStar=five_star&pageNumber=4&reviewerType=all_reviews||
"1556764748-1576,https://www.amazon.com/Window-Unfortunate-Events-Snicket-2000-02-02/product-reviews/B017WQ76PQ/ref=cm_cr_arp_d_hist_5?ie=UTF8&reviewerType=all_reviews&filterByStar=five_star&pageNumber=1,holly snow,thanks,14-Apr-14,""woohoo i love it  thanks for selling it to me"||||||||||
have an good day always||||||||||
"i hope you are very successful"",5.0 out of 5 stars,Next page?,https://www.amazon.com/Window-Unfortunate-Events-Snicket-2000-02-02/product-reviews/B017WQ76PQ/ref=cm_cr_arp_d_paging_btm_9?ie=UTF8&filterByStar=five_star&pageNumber=9&reviewerType=all_reviews"||||||||||
"1556764766-1662,https://www.amazon.com/Window-Unfortunate-Events-Snicket-2000-02-02/product-reviews/B017WQ76PQ/ref=cm_cr_arp_d_hist_5?ie=UTF8&reviewerType=all_reviews&filterByStar=five_star&pageNumber=1,Jeff,Don't throw this book out the window!,19-Jan-06,""The 3rd in the series. The orphans get appointed to live with their Aunt, who is....well.....weird."||||||||||
||||||||||
"If I was one of the baudelaires, I'd be happy to see Count Olaf. """"take me away from this crazy woman!"""" So the Count is up to the usual,and its up to the baudelaires to save their guardian,something they haven't done before. They succeed...kinda."||||||||||
||||||||||
They take her out of the cave she had been hiding in| but she falls out of the boat and gets eaten by leeches| luckily Mr.poe discovers Count Olaf's presence| but he gets away.|||||||
||||||||||
"3 books in and the series is still good"",5.0 out of 5 stars,Next page?,https://www.amazon.com/Window-Unfortunate-Events-Snicket-2000-02-02/product-reviews/B017WQ76PQ/ref=cm_cr_arp_d_paging_btm_17?ie=UTF8&filterByStar=five_star&pageNumber=17&reviewerType=all_reviews"||||||||||
"1556764750-1592,https://www.amazon.com/Window-Unfortunate-Events-Snicket-2000-02-02/product-reviews/B017WQ76PQ/ref=cm_cr_arp_d_hist_5?ie=UTF8&reviewerType=all_reviews&filterByStar=five_star&pageNumber=1,Camille mikayala burton,The best book ever!!,16-Jan-15,""I love this author so much he or she writes the best books ever!!"||||||||||
"Your life will change if you read the books!??"",5.0 out of 5 stars,Next page?,https://www.amazon.com/Window-Unfortunate-Events-Snicket-2000-02-02/product-reviews/B017WQ76PQ/ref=cm_cr_arp_d_paging_btm_10?ie=UTF8&filterByStar=five_star&pageNumber=10&reviewerType=all_reviews"||||||||||
"1556764732-1507,https://www.amazon.com/Window-Unfortunate-Events-Snicket-2000-02-02/product-reviews/B017WQ76PQ/ref=cm_cr_arp_d_hist_5?ie=UTF8&reviewerType=all_reviews&filterByStar=five_star&pageNumber=1,Kindle Customer,Five Stars,21-Jan-18,""These books are fun. It's nice to read a book that's obviously been written by an intelligent, clever author."",5.0 out of 5 stars,Next page?,https://www.amazon.com/Window-Unfortunate-Events-Snicket-2000-02-02/product-reviews/B017WQ76PQ/ref=cm_cr_arp_d_paging_btm_2?ie=UTF8&filterByStar=five_star&pageNumber=2&reviewerType=all_reviews"||||||||||
